season,niche,primary_keyword,secondary_keyword,long_tail
Mothers Day,Dog Moms,Mothers Day Dog Moms gift,funny Dog Moms Mothers Day,personalized Dog Moms Mothers Day gift 2026
Mothers Day,Cat Moms,Mothers Day Cat Moms gift,funny Cat Moms Mothers Day,personalized Cat Moms Mothers Day gift 2026
Mothers Day,Teachers,Mothers Day Teachers gift,funny Teachers Mothers Day,personalized Teachers Mothers Day gift 2026
Mothers Day,Nurses,Mothers Day Nurses gift,funny Nurses Mothers Day,personalized Nurses Mothers Day gift 2026
Mothers Day,Book Lovers,Mothers Day Book Lovers gift,funny Book Lovers Mothers Day,personalized Book Lovers Mothers Day gift 2026
Mothers Day,Gamers,Mothers Day Gamers gift,funny Gamers Mothers Day,personalized Gamers Mothers Day gift 2026
Mothers Day,New Moms,Mothers Day New Moms gift,funny New Moms Mothers Day,personalized New Moms Mothers Day gift 2026
Mothers Day,New Dads,Mothers Day New Dads gift,funny New Dads Mothers Day,personalized New Dads Mothers Day gift 2026
Mothers Day,Graduation Families,Mothers Day Graduation Families gift,funny Graduation Families Mothers Day,personalized Graduation Families Mothers Day gift 2026
Mothers Day,Grandmas/Nanas,Mothers Day Grandmas Nanas gift,funny Grandmas Nanas Mothers Day,personalized Grandmas Nanas Mothers Day gift 2026
Mothers Day,Coffee Lovers,Mothers Day Coffee Lovers gift,funny Coffee Lovers Mothers Day,personalized Coffee Lovers Mothers Day gift 2026
Mothers Day,Christian Moms,Mothers Day Christian Moms gift,funny Christian Moms Mothers Day,personalized Christian Moms Mothers Day gift 2026
Fathers Day,Dog Moms,Fathers Day Dog Moms gift,funny Dog Moms Fathers Day,personalized Dog Moms Fathers Day gift 2026
Fathers Day,Cat Moms,Fathers Day Cat Moms gift,funny Cat Moms Fathers Day,personalized Cat Moms Fathers Day gift 2026
Fathers Day,Teachers,Fathers Day Teachers gift,funny Teachers Fathers Day,personalized Teachers Fathers Day gift 2026
Fathers Day,Nurses,Fathers Day Nurses gift,funny Nurses Fathers Day,personalized Nurses Fathers Day gift 2026
Fathers Day,Book Lovers,Fathers Day Book Lovers gift,funny Book Lovers Fathers Day,personalized Book Lovers Fathers Day gift 2026
Fathers Day,Gamers,Fathers Day Gamers gift,funny Gamers Fathers Day,personalized Gamers Fathers Day gift 2026
Fathers Day,New Moms,Fathers Day New Moms gift,funny New Moms Fathers Day,personalized New Moms Fathers Day gift 2026
Fathers Day,New Dads,Fathers Day New Dads gift,funny New Dads Fathers Day,personalized New Dads Fathers Day gift 2026
Fathers Day,Graduation Families,Fathers Day Graduation Families gift,funny Graduation Families Fathers Day,personalized Graduation Families Fathers Day gift 2026
Fathers Day,Grandmas/Nanas,Fathers Day Grandmas Nanas gift,funny Grandmas Nanas Fathers Day,personalized Grandmas Nanas Fathers Day gift 2026
Fathers Day,Coffee Lovers,Fathers Day Coffee Lovers gift,funny Coffee Lovers Fathers Day,personalized Coffee Lovers Fathers Day gift 2026
Fathers Day,Christian Moms,Fathers Day Christian Moms gift,funny Christian Moms Fathers Day,personalized Christian Moms Fathers Day gift 2026
Graduation,Dog Moms,Graduation Dog Moms gift,funny Dog Moms Graduation,personalized Dog Moms Graduation gift 2026
Graduation,Cat Moms,Graduation Cat Moms gift,funny Cat Moms Graduation,personalized Cat Moms Graduation gift 2026
Graduation,Teachers,Graduation Teachers gift,funny Teachers Graduation,personalized Teachers Graduation gift 2026
Graduation,Nurses,Graduation Nurses gift,funny Nurses Graduation,personalized Nurses Graduation gift 2026
Graduation,Book Lovers,Graduation Book Lovers gift,funny Book Lovers Graduation,personalized Book Lovers Graduation gift 2026
Graduation,Gamers,Graduation Gamers gift,funny Gamers Graduation,personalized Gamers Graduation gift 2026
Graduation,New Moms,Graduation New Moms gift,funny New Moms Graduation,personalized New Moms Graduation gift 2026
Graduation,New Dads,Graduation New Dads gift,funny New Dads Graduation,personalized New Dads Graduation gift 2026
Graduation,Graduation Families,Graduation Graduation Families gift,funny Graduation Families Graduation,personalized Graduation Families Graduation gift 2026
Graduation,Grandmas/Nanas,Graduation Grandmas Nanas gift,funny Grandmas Nanas Graduation,personalized Grandmas Nanas Graduation gift 2026
Graduation,Coffee Lovers,Graduation Coffee Lovers gift,funny Coffee Lovers Graduation,personalized Coffee Lovers Graduation gift 2026
Graduation,Christian Moms,Graduation Christian Moms gift,funny Christian Moms Graduation,personalized Christian Moms Graduation gift 2026
Back to School,Dog Moms,Back to School Dog Moms gift,funny Dog Moms Back to School,personalized Dog Moms Back to School gift 2026
Back to School,Cat Moms,Back to School Cat Moms gift,funny Cat Moms Back to School,personalized Cat Moms Back to School gift 2026
Back to School,Teachers,Back to School Teachers gift,funny Teachers Back to School,personalized Teachers Back to School gift 2026
Back to School,Nurses,Back to School Nurses gift,funny Nurses Back to School,personalized Nurses Back to School gift 2026
Back to School,Book Lovers,Back to School Book Lovers gift,funny Book Lovers Back to School,personalized Book Lovers Back to School gift 2026
Back to School,Gamers,Back to School Gamers gift,funny Gamers Back to School,personalized Gamers Back to School gift 2026
Back to School,New Moms,Back to School New Moms gift,funny New Moms Back to School,personalized New Moms Back to School gift 2026
Back to School,New Dads,Back to School New Dads gift,funny New Dads Back to School,personalized New Dads Back to School gift 2026
Back to School,Graduation Families,Back to School Graduation Families gift,funny Graduation Families Back to School,personalized Graduation Families Back to School gift 2026
Back to School,Grandmas/Nanas,Back to School Grandmas Nanas gift,funny Grandmas Nanas Back to School,personalized Grandmas Nanas Back to School gift 2026
Back to School,Coffee Lovers,Back to School Coffee Lovers gift,funny Coffee Lovers Back to School,personalized Coffee Lovers Back to School gift 2026
Back to School,Christian Moms,Back to School Christian Moms gift,funny Christian Moms Back to School,personalized Christian Moms Back to School gift 2026
Halloween,Dog Moms,Halloween Dog Moms gift,funny Dog Moms Halloween,personalized Dog Moms Halloween gift 2026
Halloween,Cat Moms,Halloween Cat Moms gift,funny Cat Moms Halloween,personalized Cat Moms Halloween gift 2026
Halloween,Teachers,Halloween Teachers gift,funny Teachers Halloween,personalized Teachers Halloween gift 2026
Halloween,Nurses,Halloween Nurses gift,funny Nurses Halloween,personalized Nurses Halloween gift 2026
Halloween,Book Lovers,Halloween Book Lovers gift,funny Book Lovers Halloween,personalized Book Lovers Halloween gift 2026
Halloween,Gamers,Halloween Gamers gift,funny Gamers Halloween,personalized Gamers Halloween gift 2026
Halloween,New Moms,Halloween New Moms gift,funny New Moms Halloween,personalized New Moms Halloween gift 2026
Halloween,New Dads,Halloween New Dads gift,funny New Dads Halloween,personalized New Dads Halloween gift 2026
Halloween,Graduation Families,Halloween Graduation Families gift,funny Graduation Families Halloween,personalized Graduation Families Halloween gift 2026
Halloween,Grandmas/Nanas,Halloween Grandmas Nanas gift,funny Grandmas Nanas Halloween,personalized Grandmas Nanas Halloween gift 2026
Halloween,Coffee Lovers,Halloween Coffee Lovers gift,funny Coffee Lovers Halloween,personalized Coffee Lovers Halloween gift 2026
Halloween,Christian Moms,Halloween Christian Moms gift,funny Christian Moms Halloween,personalized Christian Moms Halloween gift 2026
Christmas,Dog Moms,Christmas Dog Moms gift,funny Dog Moms Christmas,personalized Dog Moms Christmas gift 2026
Christmas,Cat Moms,Christmas Cat Moms gift,funny Cat Moms Christmas,personalized Cat Moms Christmas gift 2026
Christmas,Teachers,Christmas Teachers gift,funny Teachers Christmas,personalized Teachers Christmas gift 2026
Christmas,Nurses,Christmas Nurses gift,funny Nurses Christmas,personalized Nurses Christmas gift 2026
Christmas,Book Lovers,Christmas Book Lovers gift,funny Book Lovers Christmas,personalized Book Lovers Christmas gift 2026
Christmas,Gamers,Christmas Gamers gift,funny Gamers Christmas,personalized Gamers Christmas gift 2026
Christmas,New Moms,Christmas New Moms gift,funny New Moms Christmas,personalized New Moms Christmas gift 2026
Christmas,New Dads,Christmas New Dads gift,funny New Dads Christmas,personalized New Dads Christmas gift 2026
Christmas,Graduation Families,Christmas Graduation Families gift,funny Graduation Families Christmas,personalized Graduation Families Christmas gift 2026
Christmas,Grandmas/Nanas,Christmas Grandmas Nanas gift,funny Grandmas Nanas Christmas,personalized Grandmas Nanas Christmas gift 2026
Christmas,Coffee Lovers,Christmas Coffee Lovers gift,funny Coffee Lovers Christmas,personalized Coffee Lovers Christmas gift 2026
Christmas,Christian Moms,Christmas Christian Moms gift,funny Christian Moms Christmas,personalized Christian Moms Christmas gift 2026
Evergreen,Dog Moms,Evergreen Dog Moms gift,funny Dog Moms Evergreen,personalized Dog Moms Evergreen gift 2026
Evergreen,Cat Moms,Evergreen Cat Moms gift,funny Cat Moms Evergreen,personalized Cat Moms Evergreen gift 2026
Evergreen,Teachers,Evergreen Teachers gift,funny Teachers Evergreen,personalized Teachers Evergreen gift 2026
Evergreen,Nurses,Evergreen Nurses gift,funny Nurses Evergreen,personalized Nurses Evergreen gift 2026
Evergreen,Book Lovers,Evergreen Book Lovers gift,funny Book Lovers Evergreen,personalized Book Lovers Evergreen gift 2026
Evergreen,Gamers,Evergreen Gamers gift,funny Gamers Evergreen,personalized Gamers Evergreen gift 2026
Evergreen,New Moms,Evergreen New Moms gift,funny New Moms Evergreen,personalized New Moms Evergreen gift 2026
Evergreen,New Dads,Evergreen New Dads gift,funny New Dads Evergreen,personalized New Dads Evergreen gift 2026
Evergreen,Graduation Families,Evergreen Graduation Families gift,funny Graduation Families Evergreen,personalized Graduation Families Evergreen gift 2026
Evergreen,Grandmas/Nanas,Evergreen Grandmas Nanas gift,funny Grandmas Nanas Evergreen,personalized Grandmas Nanas Evergreen gift 2026
Evergreen,Coffee Lovers,Evergreen Coffee Lovers gift,funny Coffee Lovers Evergreen,personalized Coffee Lovers Evergreen gift 2026
Evergreen,Christian Moms,Evergreen Christian Moms gift,funny Christian Moms Evergreen,personalized Christian Moms Evergreen gift 2026
